word,phonetic,definition_en,definition_ja,sentence_1,sentence_2,sentence_3
breakfast,/ˈbrek.fəst/,The first meal of the day.,朝食,I eat breakfast at seven.,What did you have for breakfast?,Breakfast is very important.
lunch,/lʌntʃ/,A meal eaten in the middle of the day.,昼食,Let's eat lunch together.,I brought my lunch to school.,What is for lunch today?
dinner,/ˈdɪn.ər/,The main meal of the day usually eaten in the evening.,夕食,Dinner is ready!,We had dinner at home.,What time do you eat dinner?
menu,/ˈmen.juː/,A list of food you can order at a restaurant.,メニュー,Can I see the menu please?,What is on the menu today?,She looked at the menu carefully.
dessert,/dɪˈzɜːt/,Sweet food eaten after a meal.,デザート,Would you like some dessert?,Ice cream is my favorite dessert.,She made a delicious dessert.
knife,/naɪf/,A tool with a sharp edge for cutting.,ナイフ・包丁,Use a knife to cut the bread.,She picked up a knife and fork.,Be careful with the knife.
pepper,/ˈpep.ər/,A spice used to add flavor to food.,コショウ,Please pass the pepper.,I put pepper on my soup.,Do you like pepper?
sugar,/ˈʃʊɡ.ər/,A sweet substance added to food and drinks.,砂糖,Do you take sugar in your tea?,Too much sugar is not healthy.,I put sugar in my coffee.
hotel,/həʊˈtel/,A building where you pay to stay in a room.,ホテル,We stayed at a nice hotel.,The hotel is near the beach.,I booked a hotel for two nights.
stay,/steɪ/,To remain in a place.,滞在する・泊まる,I will stay home today.,She stayed at a hotel.,How long will you stay here?
interesting,/ˈɪn.trəs.tɪŋ/,Making you want to know more.,興味深い・面白い,This book is very interesting.,That was an interesting story.,Japan has many interesting places.
arm,/ɑːm/,The long part of your body from shoulder to hand.,腕,She broke her arm last week.,He carried the box in his arms.,Raise your right arm.
test,/test/,A set of questions to measure your knowledge.,試験・テスト,We have a test tomorrow.,She passed the test.,I studied hard for the test.
space,/speɪs/,An empty area or the area beyond Earth.,空間・スペース・宇宙,There is no space in the room.,Astronauts travel to space.,I need more space for my books.
wide,/waɪd/,Having a large distance from side to side.,幅の広い,The river is very wide.,Open your eyes wide.,The road is wide enough for two cars.
floor,/flɔːr/,The bottom surface of a room.,床,Please clean the floor.,She sat on the floor.,My classroom is on the third floor.
thank,/θæŋk/,To tell someone you are grateful.,感謝する・お礼を言う,I want to thank you for your help.,She thanked the teacher.,Thank you very much!
village,/ˈvɪl.ɪdʒ/,A very small town in the countryside.,村,My grandmother lives in a village.,The village is very quiet.,We visited a small village.
throw,/θrəʊ/,To send something through the air with your hand.,投げる,Throw the ball to me.,She threw the ball far.,Don't throw stones.
college,/ˈkɒl.ɪdʒ/,A school for higher education.,（単科）大学,She is going to college next year.,He studied music at college.,The college is near the station.
hall,/hɔːl/,A large room or passage in a building.,ホール・廊下,We gathered in the hall.,The concert hall is very big.,Walk down the hall to the right.
quickly,/ˈkwɪk.li/,In a fast way.,素早く・急いで,He ran quickly to school.,Please finish quickly.,She quickly opened the door.
husband,/ˈhʌz.bənd/,A married man.,夫,Her husband is a doctor.,My husband cooks dinner.,She loves her husband.
heart,/hɑːt/,The organ in your chest that pumps blood.,心臓・ハート,My heart was beating fast.,She drew a heart on the card.,He has a kind heart.
ready,/ˈred.i/,Prepared and able to do something.,準備ができている,Are you ready for school?,I am ready to go.,Lunch is ready.
century,/ˈsen.tʃər.i/,A period of one hundred years.,世紀,We live in the 21st century.,The castle is from the 16th century.,Many things changed in the last century.
hit,/hɪt/,To touch something with force.,打つ・ぶつかる,He hit the ball with the bat.,Don't hit your brother.,The ball hit the window.
sound,/saʊnd/,Something you hear.,音・～に聞こえる,I heard a strange sound.,That sounds like a good idea.,The bell made a loud sound.
push,/pʊʃ/,To press against something to move it.,押す,Push the door to open it.,She pushed the button.,Don't push me!
leader,/ˈliː.dər/,A person who guides or directs others.,指導者・リーダー,She is the leader of our group.,He is a good leader.,The team leader spoke first.
daughter,/ˈdɔː.tər/,A female child.,娘,She has two daughters.,My daughter is eight years old.,His daughter likes reading.
dead,/ded/,No longer alive.,死んでいる,The flowers are dead.,He found a dead bird.,The battery is dead.
interested,/ˈɪn.trəs.tɪd/,Wanting to know more about something.,興味がある,I am interested in history.,She is interested in music.,Are you interested in cooking?
heavy,/ˈhev.i/,Having a lot of weight.,重い,This box is very heavy.,The rain was heavy yesterday.,She carried a heavy bag.
sea,/siː/,A large area of salt water.,海,We went to the sea last summer.,The sea is very beautiful.,Fish live in the sea.
stone,/stəʊn/,A small piece of rock.,石,He picked up a stone.,The wall is made of stone.,She threw a stone into the river.
front,/frʌnt/,The part that faces forward.,前方・正面,I sat in the front of the class.,The garden is in front of the house.,She stood in front of the mirror.
seat,/siːt/,A place where you can sit.,席・座席,Is this seat free?,Please take a seat.,She found a seat on the train.
science,/ˈsaɪ.əns/,The study of the natural world.,科学,I like science class.,Science helps us understand nature.,She wants to study science.
half,/hɑːf/,One of two equal parts.,半分,Half of the cake is left.,It is half past three.,I ate half of the apple.
useful,/ˈjuːs.fəl/,Helpful and practical.,役に立つ・便利な,This dictionary is very useful.,English is useful for travel.,That is useful information.
kitchen,/ˈkɪtʃ.ɪn/,The room where you cook food.,台所,My mother is in the kitchen.,We have a big kitchen.,I helped clean the kitchen.
art,/ɑːt/,The making of paintings and drawings.,芸術・美術,She is very good at art.,We have art class on Friday.,I like looking at art.
beautiful,/ˈbjuː.tɪ.fəl/,Very pretty or pleasing to look at.,美しい・きれいな,What a beautiful flower!,She has a beautiful voice.,The sunset was beautiful.
earth,/ɜːθ/,The planet we live on.,地球,The earth goes around the sun.,We should protect the earth.,The earth is very beautiful from space.
finger,/ˈfɪŋ.ɡər/,One of the five parts at the end of your hand.,（手の）指,She cut her finger.,I held up three fingers.,He pointed his finger at the map.
phone,/fəʊn/,A device used to talk to people far away.,電話,My phone is ringing.,Can I use your phone?,She is talking on the phone.
season,/ˈsiː.zən/,One of the four parts of the year.,季節・シーズン,Spring is my favorite season.,Japan has four seasons.,What season do you like best?
dark,/dɑːk/,Having little or no light.,暗い,The room is very dark.,It gets dark early in winter.,She is afraid of the dark.
cheap,/tʃiːp/,Not costing a lot of money.,安い,This bag is very cheap.,The food here is cheap and good.,I found a cheap ticket.
river,/ˈrɪv.ər/,A long flow of water across the land.,川,We swam in the river.,The river is very long.,A bridge crosses the river.
library,/ˈlaɪ.brər.i/,A place where you can borrow books.,図書館,I go to the library every week.,The library has many books.,She studies at the library.
drink,/drɪŋk/,To take liquid into your mouth.,飲む,I drink water every morning.,Would you like something to drink?,She drinks milk at breakfast.
star,/stɑːr/,A bright point of light in the night sky.,星,The stars are beautiful tonight.,I can see many stars.,She wants to be a movie star.
farm,/fɑːm/,A place where food is grown or animals are kept.,農場,We visited a farm last weekend.,The farm has cows and chickens.,My uncle has a big farm.
quick,/kwɪk/,Done in a short time.,素早い・短時間の,Let's have a quick lunch.,She gave a quick answer.,He took a quick look.
fly,/flaɪ/,To move through the air.,飛ぶ・飛行機で行く,Birds can fly.,I flew to Hokkaido last summer.,The airplane is flying very high.
travel,/ˈtræv.əl/,To go from one place to another.,旅行する,I like to travel by train.,She traveled to many countries.,We traveled around Japan.
sleep,/sliːp/,To rest with your eyes closed.,寝る,I slept for eight hours.,She sleeps early every night.,I could not sleep last night.
driver,/ˈdraɪ.vər/,A person who drives a vehicle.,運転手,The bus driver was very kind.,My father is a good driver.,She wants to be a taxi driver.
key,/kiː/,A small metal object that opens a lock.,鍵,I lost my key.,Where is the house key?,She put the key in her pocket.
telephone,/ˈtel.ɪ.fəʊn/,A device for talking to people far away.,電話,The telephone is ringing.,She answered the telephone.,May I use your telephone?
wind,/wɪnd/,Moving air outside.,風,The wind is very strong today.,The wind blew my hat away.,A cold wind is blowing.
clothes,/kləʊðz/,Things you wear on your body.,服,I need to wash my clothes.,She bought new clothes.,Put on warm clothes.
warm,/wɔːm/,Having a comfortable level of heat.,温かい・暖かい,The room is nice and warm.,She wore a warm coat.,It is warm today.
newspaper,/ˈnjuːz.peɪ.pər/,Printed paper with news and articles.,新聞,My father reads the newspaper.,I saw it in the newspaper.,She delivers newspapers in the morning.
deep,/diːp/,Going far down from the surface.,深い,The lake is very deep.,Don't go into the deep water.,She took a deep breath.
sing,/sɪŋ/,To make music with your voice.,歌う,I like to sing songs.,She sings very well.,We sang a song together.
kid,/kɪd/,A child or young person.,（日常会話で）子ども,The kids are playing outside.,She is a smart kid.,I was a quiet kid.
rich,/rɪtʃ/,Having a lot of money.,裕福な,He is a very rich man.,The country is rich in nature.,She became rich and famous.
twice,/twaɪs/,Two times.,二度,I brush my teeth twice a day.,She visited London twice.,I called you twice yesterday.
race,/reɪs/,A competition to see who is fastest.,競走・レース,He won the race.,Let's have a running race.,The race starts at ten.
yard,/jɑːd/,An area of ground next to a house.,庭,The children played in the yard.,We have a small yard.,She grows flowers in the yard.
bedroom,/ˈbed.ruːm/,A room where you sleep.,寝室,My bedroom is upstairs.,She cleaned her bedroom.,The house has three bedrooms.
quiet,/ˈkwaɪ.ət/,Making little or no noise.,静かな,Please be quiet in the library.,The street is very quiet.,She is a quiet girl.
weather,/ˈweð.ər/,The condition of the air outside.,天気,The weather is nice today.,What is the weather like?,The weather will be rainy tomorrow.
careful,/ˈkeə.fəl/,Paying attention to avoid mistakes or danger.,注意深い・慎重な,Be careful when you cross the road.,She is very careful with her work.,Please be careful with this glass.
best,/best/,Of the highest quality.,いちばん良い,This is the best movie ever.,She is my best friend.,I did my best on the test.
professional,/prəˈfeʃ.ən.əl/,Doing something as a job rather than a hobby.,プロの・専門職の,He is a professional soccer player.,She is a professional singer.,The work looks very professional.
speech,/spiːtʃ/,A talk given to a group of people.,演説・スピーチ,She gave a great speech.,I made a speech at the ceremony.,His speech was very moving.
double,/ˈdʌb.əl/,Twice as much or having two parts.,二重の・二倍の,I would like a double room please.,She ordered a double burger.,The price is double now.
bridge,/brɪdʒ/,A structure built over water or a road.,橋,We crossed the bridge.,The bridge is very old.,There is a bridge over the river.
band,/bænd/,A group of people who play music together.,楽団・バンド,He plays guitar in a band.,The band gave a great concert.,I want to join a band.
cross,/krɒs/,To go from one side to the other.,横断する・渡る,Look both ways before you cross.,She crossed the street safely.,We crossed the bridge.
rock,/rɒk/,A large piece of stone.,岩・石,He sat on a big rock.,The mountain is made of rock.,She found a beautiful rock.
ring,/rɪŋ/,A circular piece of jewelry worn on the finger.,指輪,She wears a gold ring.,He gave her a diamond ring.,I found a ring on the ground.
address,/əˈdres/,The details of where someone lives.,住所,What is your address?,Please write your address here.,I forgot the address.
outside,/ˌaʊtˈsaɪd/,Not inside a building.,外で・外に,Let's play outside.,It is cold outside today.,The dog is waiting outside.
title,/ˈtaɪ.təl/,The name of a book or movie.,表題・タイトル,What is the title of this book?,I forgot the title of the movie.,She chose a good title for her essay.
shout,/ʃaʊt/,To speak very loudly.,叫ぶ・大声で言う,Don't shout in the classroom.,He shouted my name.,She shouted for help.
magazine,/ˌmæɡ.əˈziːn/,A thin book with stories and pictures.,雑誌,I read a fashion magazine.,She bought a sports magazine.,There are many magazines in the store.
wonderful,/ˈwʌn.dər.fəl/,Extremely good or pleasing.,すばらしい・すてきな,We had a wonderful time.,What wonderful weather!,She is a wonderful teacher.
shoe,/ʃuː/,A covering for your foot.,靴,I bought new shoes.,These shoes are too small.,Take off your shoes at the door.
present,/ˈprez.ənt/,Something you give to someone on a special day.,プレゼント・おくり物,I got a present for my birthday.,She gave me a nice present.,What present do you want?
zebra,/ˈzeb.rə/,A black and white striped animal from Africa.,シマウマ,We saw a zebra at the zoo.,Zebras live in Africa.,The zebra has black and white stripes.
deer,/dɪər/,A wild animal with long legs that lives in forests.,鹿,I saw a deer in Nara.,Deer are beautiful animals.,The deer ate the leaves.
sheep,/ʃiːp/,A farm animal that gives us wool.,羊,The farmer has many sheep.,Sheep eat grass in the field.,We counted the sheep.
fox,/fɒks/,A wild animal that looks like a small dog.,キツネ,We saw a fox in the forest.,The fox ran into the woods.,A red fox lives near our house.
rat,/ræt/,A small animal with a long tail.,（大型の）ネズミ,I saw a rat in the garden.,Rats are very clever animals.,The cat chased the rat.
kangaroo,/ˌkæŋ.ɡəˈruː/,A large Australian animal that jumps.,カンガルー,Kangaroos live in Australia.,The kangaroo carried its baby.,We saw a kangaroo at the zoo.
bear,/beər/,A large strong animal with thick fur.,クマ,Bears live in the mountains.,We saw a bear at the zoo.,The bear caught a fish.
duck,/dʌk/,A water bird with a flat beak.,カモ・アヒル,The ducks are swimming in the pond.,I like feeding the ducks.,The duck has yellow babies.
penguin,/ˈpeŋ.ɡwɪn/,A black and white bird that cannot fly.,ペンギン,Penguins live in cold places.,The penguin waddled on the ice.,We saw penguins at the aquarium.
dream,/driːm/,Pictures and thoughts in your mind while you sleep.,夢・理想,I had a nice dream last night.,My dream is to travel the world.,She dreams of becoming a singer.
dry,/draɪ/,Not wet.,乾燥した・乾いた,The clothes are dry now.,It is a dry and sunny day.,Please dry your hands.
clean,/kliːn/,Free from dirt.,清潔な・汚れていない,Keep your room clean.,The water is very clean.,She cleaned her desk.
funny,/ˈfʌn.i/,Making you laugh.,面白い・おかしい,He told a funny joke.,That movie was very funny.,She has a funny face.
tooth,/tuːθ/,One of the hard white parts in your mouth.,歯,My tooth hurts.,I lost a tooth yesterday.,Brush your teeth every day.
nurse,/nɜːs/,A person who takes care of sick people.,看護師,The nurse was very kind.,She wants to be a nurse.,The nurse gave me medicine.
dangerous,/ˈdeɪn.dʒər.əs/,Likely to cause harm or injury.,危険な,Swimming alone is dangerous.,That road is very dangerous.,Don't touch! It is dangerous.
gate,/ɡeɪt/,A door in a wall or fence.,門・出入口,Close the gate please.,The school gate opens at eight.,We waited at the gate.
cry,/kraɪ/,To produce tears from your eyes.,泣く,The baby is crying.,Don't cry.,She cried when she heard the news.
bath,/bɑːθ/,Washing your body in a tub of water.,風呂,I take a bath every night.,The bath is warm and nice.,She is in the bath.
lesson,/ˈles.ən/,A period of time for learning.,授業・レッスン,We have six lessons today.,The lesson starts at nine.,She takes piano lessons.
sick,/sɪk/,Not feeling well or having a disease.,気分が悪い・病気の,I feel sick today.,She was sick yesterday.,He stayed home because he was sick.
neck,/nek/,The part of your body between your head and shoulders.,首,I have a pain in my neck.,She wore a necklace around her neck.,Giraffes have long necks.
culture,/ˈkʌl.tʃər/,The customs and beliefs of a group of people.,文化,Japanese culture is very interesting.,I want to learn about other cultures.,Food is a big part of culture.
trip,/trɪp/,A journey to a place and back.,旅行,We went on a school trip.,How was your trip?,I enjoyed the trip to Kyoto.
coat,/kəʊt/,A piece of clothing you wear over other clothes.,コート,Put on your coat.,She bought a warm winter coat.,Hang your coat on the hook.
slowly,/ˈsləʊ.li/,At a low speed.,ゆっくりと,Please speak slowly.,He walked slowly to school.,The turtle moved slowly.
nose,/nəʊz/,The part of your face you breathe through.,鼻,My nose is cold.,She has a small nose.,He blew his nose.
slow,/sləʊ/,Not fast.,（動きが）遅い・ゆっくりした,The bus is very slow today.,He is a slow runner.,Please walk slow.
dear,/dɪər/,A word used to show love or affection.,親愛な・大切な,Dear Mom and Dad.,She is a dear friend.,Oh dear! I forgot my key.
alone,/əˈləʊn/,Without other people.,一人で,She lives alone.,I was alone at home.,He likes to study alone.
tired,/taɪəd/,Needing rest or sleep.,疲れている,I am very tired today.,She was tired after running.,He looks tired.
pizza,/ˈpiːt.sə/,A flat round food with cheese on top.,ピザ,I like pizza very much.,Let's order a pizza.,She made pizza for dinner.
beef,/biːf/,Meat from a cow.,牛肉,I had beef for dinner.,This beef is very tender.,She cooked beef curry.
trumpet,/ˈtrʌm.pɪt/,A brass musical instrument you blow into.,トランペット,He plays the trumpet.,The trumpet has a loud sound.,She is learning to play the trumpet.
violin,/ˌvaɪ.əˈlɪn/,A stringed musical instrument played with a bow.,バイオリン,She plays the violin beautifully.,I want to learn the violin.,The violin makes a lovely sound.
video game,/ˈvɪd.i.əʊ ɡeɪm/,A game played on a screen.,ビデオゲーム・テレビゲーム,I like playing video games.,He bought a new video game.,Don't play video games too much.
dictionary,/ˈdɪk.ʃən.ər.i/,A book that explains the meanings of words.,辞書,Look it up in the dictionary.,I use an English dictionary.,She bought a new dictionary.
actor,/ˈæk.tər/,A person who acts in movies or plays.,俳優,He is a famous actor.,She wants to be an actor.,The actor was very talented.
airplane,/ˈeə.pleɪn/,A vehicle that flies in the sky.,飛行機,The airplane took off on time.,I saw an airplane in the sky.,We traveled by airplane.
glove,/ɡlʌv/,A covering for your hand.,手袋,She wore warm gloves.,I lost one glove.,Put on your gloves.
rainy,/ˈreɪ.ni/,Having a lot of rain.,雨の,It is a rainy day today.,Bring an umbrella on rainy days.,June is a rainy month in Japan.
stew,/stjuː/,A dish of meat and vegetables cooked slowly.,シチュー,My mother made beef stew.,The stew is very warm and tasty.,I like eating stew in winter.
so,/səʊ/,To a great degree or very.,とても,I am so happy today.,She runs so fast.,It is so cold outside.
have to,/hæv tuː/,To be required to do something.,～しなければならない,I have to go to school.,She has to study tonight.,We have to clean the room.
something,/ˈsʌm.θɪŋ/,An unknown or unnamed thing.,何か,I want to eat something.,Did you say something?,Something smells good.
tent,/tent/,A shelter made of cloth used for camping.,テント,We put up a tent in the field.,The tent was small but warm.,They slept in a tent.
cloud,/klaʊd/,A white or grey mass in the sky.,雲,There are no clouds in the sky.,The clouds look like animals.,Dark clouds mean rain is coming.
cute,/kjuːt/,Attractive in a sweet way.,かわいい,Your dog is very cute.,She drew a cute picture.,The baby is so cute!
artist,/ˈɑː.tɪst/,A person who creates art.,芸術家・美術家,She is a famous artist.,The artist painted a beautiful picture.,I want to be an artist.
musician,/mjuːˈzɪʃ.ən/,A person who plays music.,音楽家・ミュージシャン,He is a talented musician.,The musician played the guitar.,She wants to be a musician.
poster,/ˈpəʊ.stər/,A large printed picture or notice.,ポスター,There is a poster on the wall.,She made a poster for the festival.,I bought a movie poster.
healthy,/ˈhel.θi/,In good condition of body and mind.,健康な・健康によい,Eating vegetables is healthy.,She is a healthy girl.,Exercise keeps you healthy.
Halloween,/ˌhæl.əʊˈiːn/,A holiday on October 31st with costumes.,ハロウィーン,We wear costumes on Halloween.,Halloween is very fun.,She made a pumpkin for Halloween.
cookie,/ˈkʊk.i/,A small flat sweet cake.,クッキー,She baked chocolate cookies.,Would you like a cookie?,I ate two cookies after lunch.
tie,/taɪ/,A long narrow piece of cloth worn around the neck.,ネクタイ,He wears a red tie.,My father put on his tie.,She gave him a tie for his birthday.
movie,/ˈmuː.vi/,A story shown on a screen.,映画,Let's watch a movie tonight.,That was a great movie.,What movie do you want to see?
cousin,/ˈkʌz.ən/,A child of your uncle or aunt.,いとこ,My cousin lives in Osaka.,She visited her cousin.,I played with my cousin yesterday.
pretty,/ˈprɪt.i/,Nice to look at.,きれいな,She is very pretty.,What a pretty flower!,The dress is very pretty.
steak,/steɪk/,A thick piece of meat.,ステーキ,I ate a steak for dinner.,She likes steak with salad.,The steak was very tender.
museum,/mjuːˈziː.əm/,A building where you can see art or historical things.,博物館,We visited the science museum.,The museum was very interesting.,There is a new museum in town.
both,/bəʊθ/,Two people or things together.,両方の,I like both cats and dogs.,Both answers are correct.,They are both students.
toast,/təʊst/,Bread that has been made brown by heat.,トースト,I had toast for breakfast.,She made toast and jam.,Would you like some toast?
but,/bʌt/,Used to introduce something different.,しかし,I like cats but I have a dog.,She is small but very strong.,The test was hard but fair.
sky,/skaɪ/,The space above the earth.,空,The sky is blue today.,I saw a bird in the sky.,Stars shine in the night sky.
engineer,/ˌen.dʒɪˈnɪər/,A person who designs or builds things.,技師・技術者,He is a software engineer.,She wants to be an engineer.,The engineer designed a bridge.
singer,/ˈsɪŋ.ər/,A person who sings.,歌手,She is a popular singer.,The singer has a beautiful voice.,I want to be a singer.
writer,/ˈraɪ.tər/,A person who writes books or stories.,作家・作者,He is a famous writer.,She is a great writer.,The writer published a new book.
smile,/smaɪl/,To show happiness with your face.,ほほえむ,She smiled at me.,He always has a big smile.,Please smile for the photo.
drum,/drʌm/,A musical instrument you hit with sticks.,ドラム,He plays the drums.,The drum makes a loud sound.,She practices drums after school.
musical,/ˈmjuː.zɪ.kəl/,A play or movie with singing and dancing.,ミュージカル,We saw a musical last weekend.,She loves watching musicals.,The musical was wonderful.
blackboard,/ˈblæk.bɔːd/,A dark board on the wall for writing with chalk.,黒板,The teacher wrote on the blackboard.,Please clean the blackboard.,I can see the blackboard clearly.
chalk,/tʃɔːk/,A soft white stick used for writing on a blackboard.,チョーク,She picked up the chalk and wrote.,We need more chalk.,The chalk broke in half.
meat,/miːt/,The flesh of an animal eaten as food.,肉,I eat meat for dinner.,She does not eat meat.,What kind of meat do you like?
juice,/dʒuːs/,A drink made from fruit.,ジュース,I drink orange juice every morning.,Would you like some apple juice?,She poured juice into a glass.
sausage,/ˈsɒs.ɪdʒ/,A tube of meat mixed with spices.,ソーセージ,I had sausages for breakfast.,She grilled some sausages.,Do you like sausage?
toy,/tɔɪ/,An object for children to play with.,おもちゃ,The child played with his toys.,She bought a new toy.,This is my favorite toy.
do,/duː/,To perform an action.,する,What do you do on weekends?,I do my homework every day.,She does the dishes after dinner.
onion,/ˈʌn.jən/,A round vegetable that makes you cry when you cut it.,タマネギ,I put onions in the curry.,She cut the onion.,Onions make me cry.
promise,/ˈprɒm.ɪs/,To tell someone you will do something.,約束する,I promise to help you.,She promised to come early.,Please keep your promise.
jungle,/ˈdʒʌŋ.ɡəl/,A thick tropical forest.,ジャングル,Many animals live in the jungle.,The jungle is hot and wet.,We learned about the jungle in class.
adventure,/ədˈven.tʃər/,An exciting and unusual experience.,冒険,I read an adventure story.,She had a great adventure in the mountains.,Life is a big adventure.
