word,phonetic,definition_en,definition_ja,sentence_1,sentence_2,sentence_3
visit,/ˈvɪz.ɪt/,To go to see a person or place.,訪問する,I want to visit my grandmother.,We visited a beautiful temple in Kyoto.,He will visit Canada next summer.
need,/niːd/,To require something because it is necessary.,必要とする,I need a clean glass of water.,Do you need any help?,We need food and shelter to live.
swim,/swɪm/,To move through water using your body.,泳ぐ,I like to swim in the sea.,Can you swim across the pool?,He swims every Tuesday after school.
put,/pʊt/,To place something in a particular position.,置く,Please put the book on the table.,She put the keys in her bag.,He put butter on his bread.
answer,/ˈæn.sər/,To say or write something back to a question.,答える,Please answer my question.,He gave a quick answer.,Do you know the answer?
send,/send/,To make something go to another place.,送る,I will send a letter to my friend.,She sent me an email yesterday.,Can you send this package for me?
forget,/fəˈɡet/,To not remember something.,忘れる,Don't forget your umbrella today.,I forgot my homework at home.,She always forgets her keys.
carry,/ˈkær.i/,To hold and move something from one place to another.,運ぶ,Please carry this heavy box.,She carried the baby in her arms.,He always carries a small bag.
plane,/pleɪn/,A large vehicle that flies.,飛行機,The plane will land soon.,We traveled by plane to Okinawa.,I saw a white plane in the sky.
math,/mæθ/,The study of numbers and shapes.,数学,I have a math test today.,Math is my favorite subject.,He is very good at math.
now,/naʊ/,At the present time.,今,I want to go home now.,Where are you now?,School is starting now.
holiday,/ˈhɒl.ɪ.deɪ/,A special day when you do not have to work or go to school.,祝日,Today is a national holiday.,What did you do on your holiday?,We are going on holiday next week.
farmer,/ˈfɑːr.mər/,A person who owns or works on a farm.,農家,The farmer grows fresh vegetables.,My uncle is a farmer.,We visited a friendly farmer yesterday.
window,/ˈwɪn.dəʊ/,An opening in a wall to let in light and air.,窓,Please open the window for fresh air.,I can see the park from my window.,She closed the window because of the wind.
bread,/bred/,A common food made from flour and water.,パン,I eat warm bread every morning.,Would you like some fresh bread?,He put butter on his bread.
busy,/ˈbɪz.i/,Having a lot of things to do.,忙しい,My father is very busy today.,Monday is a busy day.,She is busy doing her homework.
famous,/ˈfeɪ.məs/,Known by many people.,有名な,He is a famous soccer player.,This restaurant is famous for its food.,We visited a famous castle.
fast,/fæst/,Moving or doing something quickly.,速い,He runs very fast.,This is a fast train.,How fast can you run?
often,/ˈɒf.ən/,Many times or frequently.,しばしば・よく,How often do you swim?,I often play tennis with my friend.,It often rains here in summer.
easily,/ˈiː.zɪ.li/,Without any difficulty.,簡単に,You can do this task easily.,She speaks English easily.,He learns new words easily.
still,/stɪl/,Continuing until now.,今でも・まだ,I am still doing my homework.,Is it still raining outside?,He still lives in Tokyo.
always,/ˈɔːl.weɪz/,At all times or every time.,いつも,She always smiles at me.,I always wake up at six.,He always does his best.
ride,/raɪd/,"To travel on a horse, bicycle, or motorcycle.",乗る,I ride my bicycle to school.,He likes to ride horses.,She learned how to ride a bike.
cut,/kʌt/,To use a sharp tool to divide something.,切る,Please cut the paper with scissors.,She cut the cake into eight pieces.,I need to cut my hair.
invite,/ɪnˈvaɪt/,To ask someone to come to a social event.,招待する,I want to invite my friends to my party.,She invited us to dinner.,Thank you for inviting me.
drop,/drɒp/,To let something fall.,落とす,Please don't drop that glass.,She dropped her bag on the floor.,Leaves drop from trees in autumn.
record,/rɪˈkɔːd/,"To store music, sound, or information.",記録する,We record our voices in class.,He wants to record a song.,She records her daily activities.
sell,/sel/,To give something to someone in exchange for money.,売る,This store sells fresh fruit.,He wants to sell his old bicycle.,Do you sell newspapers here?
wake,/weɪk/,To stop sleeping or make someone stop sleeping.,目が覚める,What time do you wake up?,Please wake me up at seven.,I woke up early this morning.
arrive,/əˈraɪv/,To reach a place at the end of a journey.,到着する,The bus will arrive in a minute.,We arrived at the airport early.,What time does the train arrive?
pond,/pɒnd/,A small area of still water.,池,There are many fish in the pond.,We walked around the quiet pond.,He threw a small stone into the pond.
hobby,/ˈhɒb.i/,An activity done for pleasure in free time.,趣味,My hobby is playing tennis.,Do you have any hobbies?,Her hobby is painting flowers.
shoulder,/ˈʃəʊl.dər/,The joint connecting the arm with the torso.,肩,He carried a bag on his shoulder.,My shoulder hurts today.,She touched my shoulder to wake me.
toothbrush,/ˈtuːθ.brʌʃ/,A small brush used for cleaning teeth.,歯ブラシ,I bought a blue toothbrush.,Don't forget your toothbrush.,You should change your toothbrush regularly.
salt,/sɔːlt/,A white substance used to flavor food.,塩,Please pass the salt.,There is too much salt in this soup.,We need some salt for cooking.
dress,/dres/,A one-piece garment for women or girls.,ドレス,She is wearing a beautiful red dress.,I want to buy a new dress.,She wore a white dress to the party.
office,/ˈɒf.ɪs/,A room or building where people work at desks.,会社・事務所,My father works in a big office.,She goes to the office every morning.,The office is near the station.
luck,/lʌk/,Good things that happen by chance.,運,Good luck with your test today!,I had no luck finding my keys.,Seven is a symbol of luck.
safe,/seɪf/,Not in danger or likely to be harmed.,安全な,Is this place safe?,We had a safe journey.,Please stay in a safe place.
tonight,/təˈnaɪt/,On this present night.,今夜,What are you doing tonight?,We are going to eat pizza tonight.,The stars are very bright tonight.
sometime,/ˈsʌm.taɪm/,At some unknown or undecided time.,いつか,Let's play tennis sometime next week.,Please visit my home sometime.,I want to travel to America sometime.
usual,/ˈjuː.ʒu.əl/,Normal or happening most of the time.,いつもの,We met at our usual place.,He was late as usual.,This is my usual breakfast.
strong,/strɒŋ/,Having great power or physical strength.,強い,He is a very strong player.,The wind is very strong today.,We need strong bags for these books.
simple,/ˈsɪm.pəl/,Easy to understand or do.,単純な・簡単な,This is a very simple question.,She wrote a simple song.,He gave a simple answer.
social,/ˈsəʊ.ʃəl/,Relating to society or public activities.,社会の,We study social studies at school.,He has good social skills.,This is a popular social event.
like doing,/laɪk ˈduː.ɪŋ/,To enjoy performing an activity.,～するのが好きだ,I like doing sports on weekends.,She likes doing crossword puzzles.,Do you like doing your homework?
want to be,/wɒnt tuː biː/,To desire to become something.,～になりたいと思う,I want to be a teacher.,She wants to be a doctor.,Do you want to be famous?
need to do,/niːd tuː duː/,To have an obligation to perform an action.,～する必要がある,I need to do my homework now.,We need to do some shopping.,Do you need to do this today?
go home,/ɡəʊ həʊm/,To travel to the place where you live.,帰宅する,I want to go home now.,Let's go home together.,He went home after school.
get home,/ɡet həʊm/,To arrive at the place where you live.,帰宅する,What time do you get home?,I usually get home at six.,She got home safe and sound.
come home,/kʌm həʊm/,To return to your home.,帰宅する,When will she come home?,Please come home early tonight.,He came home late yesterday.
do one's homework,/duː wʌnz ˈhəʊm.wɜːk/,To complete school work assigned for home.,宿題をする,Please do your homework before dinner.,I have to do my homework now.,She always does her homework on time.
take A to B,/teɪk eɪ tuː biː/,To carry or accompany A to place B.,AをBに連れていく,I will take my dog to the park.,Please take these books to the library.,My father took us to the museum.
look for,/lʊk fɔːr/,To search for something or someone.,～を探す,What are you looking for?,I am looking for my keys.,She is looking for a new book.
leave for,/liːv fɔːr/,To depart in the direction of a destination.,～に向かって出発する,I will leave for the station soon.,We are leaving for Tokyo tomorrow.,What time do you leave for school?
have a good time,/hæv ə ɡʊd taɪm/,To enjoy oneself or have fun.,楽しい時を過ごす,Have a good time at the party!,We had a good time yesterday.,I hope you have a good time.
wait for,/weɪt fɔːr/,To remain inactive until someone or something arrives.,～を待つ,Who are you waiting for?,I am waiting for the bus.,Please wait for me.
stay in,/steɪ ɪn/,To lodge or live temporarily in a place.,（場所）に泊まる,We will stay in a beautiful hotel.,How long did you stay in London?,He stayed in his room all day.
stay with,/steɪ wɪð/,To live temporarily at someone's house.,（人）の所に泊まる,I want to stay with my uncle next summer.,She is staying with her friend this week.,They stayed with us for three days.
get up,/ɡet ʌp/,To rise from bed after sleeping.,起きる,What time do you get up?,I get up at six every morning.,Please get up now.
have a cold,/hæv ə kəʊld/,To be sick with a common cold.,風邪をひいている,I stayed home because I have a cold.,Do you have a cold?,He has a bad cold today.
take a bath,/teɪk ə bɑːθ/,To wash oneself in a tub of water.,入浴する,I like to take a bath before bed.,Did you take a bath?,He takes a warm bath every evening.
take a shower,/teɪk ə ˈʃaʊ.ər/,To wash oneself under a spray of water.,シャワーを浴びる,I take a shower in the morning.,She is taking a shower now.,It is refreshing to take a shower.
take a walk,/teɪk ə wɔːk/,To go for a stroll for pleasure or exercise.,散歩をする,Let's take a walk in the park.,I take a walk with my dog every morning.,They took a walk along the river.
go out,/ɡəʊ aʊt/,To leave one's home for a social activity.,外出する,I want to go out with my friends.,We are going out for dinner tonight.,Don't go out without your coat.
say goodbye to,/seɪ ɡʊdˈbaɪ tuː/,To express farewell to someone.,～に別れのあいさつを言う,I went to say goodbye to my friend.,Let's say goodbye to everyone.,She said goodbye to her mother.
grade,/ɡreɪd/,A level of study or score in school.,成績・学年,I got a good grade on my test.,He is in the sixth grade.,She got high grades this year.
dentist,/ˈden.tɪst/,A doctor who takes care of teeth.,歯医者,I have to see the dentist today.,The dentist checked my teeth.,My mother took me to the dentist.
physical education,/ˈfɪz.ɪ.kəl ˌed.jʊˈkeɪ.ʃən/,School class for sports and exercise.,体育,We have physical education on Monday.,Physical education is fun.,I like physical education class.
center,/ˈsen.tər/,The middle point of an area or object.,中心,The park is in the center of the city.,He put the vase in the center of the table.,We went to a shopping center.
notice,/ˈnəʊ.tɪs/,To see or become aware of something.,気づく・通知,Did you notice the flowers in the garden?,I noticed a new student in class.,There was a notice on the wall.
apartment,/əˈpɑːrt.mənt/,A set of rooms to live in inside a larger building.,アパート・マンション,We live in a small apartment.,My apartment has two bedrooms.,She moved to a new apartment.
cafeteria,/ˌkæf.ɪˈtɪə.ri.ə/,A self-service restaurant at school or work.,（セルフサービスの）食堂,We eat lunch in the cafeteria.,The cafeteria has good food.,Let's meet at the cafeteria.
goods,/ɡʊdz/,Things that are made to be sold.,物品・商品,This store sells many goods.,The goods arrived this morning.,They sell Japanese goods here.
water,/ˈwɔː.tər/,To pour water on plants.,水をやる,Please water the flowers every day.,I water the garden in the morning.,She watered the plants yesterday.
turn on,/tɜːn ɒn/,To start a machine or device.,～をつける,Please turn on the light.,He turned on the TV.,Can you turn on the computer?
turn off,/tɜːn ɒf/,To stop a machine or device.,～を消す,Don't forget to turn off the light.,She turned off her phone.,Please turn off the radio.
thanks to,/θæŋks tuː/,Because of something or someone.,～のおかげで,"Thanks to your help, I finished my homework.","Thanks to the sunny weather, we went outside.",We won the game thanks to our team.
next to,/nekst tuː/,Very close to something or someone.,～の隣に,The post office is next to the bank.,I sat next to my friend in class.,My house is next to a park.
kindly,/ˈkaɪnd.li/,In a kind or friendly way.,親切に,She kindly helped me with my homework.,He kindly showed me the way.,The old man spoke kindly to us.
model,/ˈmɒd.əl/,A small copy or example of something.,モデル・型,He made a model airplane.,This is the newest model.,She is a fashion model.
none,/nʌn/,Not any or not one.,何も～ない・誰も～ない,None of the students were late.,I wanted some cake but none was left.,None of my friends are here today.
interview,/ˈɪn.tə.vjuː/,A meeting where someone asks you questions.,面接・インタビュー,She had a job interview today.,The reporter did an interview with the singer.,I watched an interesting interview on TV.
take part in,/teɪk pɑːrt ɪn/,To join or participate in an activity.,～に参加する,I want to take part in the contest.,He took part in the school festival.,Let's take part in the race.
run,/rʌn/,To manage or operate a business.,経営する・管理する,He runs a small restaurant.,My parents run a flower shop.,She runs a cooking class.
look forward to,/lʊk ˈfɔː.wəd tuː/,To feel excited about something that will happen.,～を楽しみにする,I look forward to your letter.,She is looking forward to summer.,We look forward to seeing you.
manager,/ˈmæn.ɪ.dʒər/,A person who is in charge of a business or team.,管理職者・管理者,He is the manager of a hotel.,The manager gave us instructions.,I spoke to the store manager.
information,/ˌɪn.fəˈmeɪ.ʃən/,Facts or details about something.,情報,I need more information about this.,Where can I get information?,This website has useful information.
company,/ˈkʌm.pə.ni/,A business organization that sells goods or services.,会社,My mother works for a big company.,He started his own company.,That company makes good phones.
future,/ˈfjuː.tʃər/,The time that is to come.,将来,What do you want to be in the future?,The future is full of hope.,I will study harder in the future.
date,/deɪt/,A particular day of the month or year.,日付・日取り,What is today's date?,Please write the date here.,We set the date for the party.
job,/dʒɒb/,Work that you do regularly to earn money.,仕事,He is looking for a new job.,What is your dream job?,She has a part-time job.
bank,/bæŋk/,A place where people keep their money.,銀行,I went to the bank this morning.,The bank is near the station.,She works at a bank.
computer,/kəmˈpjuː.tər/,An electronic machine that stores and processes data.,コンピュータ,I use a computer every day.,He is good at using computers.,My computer is very old.
buy,/baɪ/,To get something by paying money.,買う,I want to buy a new bag.,She bought some flowers.,Where did you buy this?
important,/ɪmˈpɔː.tənt/,Having great value or meaning.,重要な・大切な,This test is very important.,English is an important subject.,It is important to eat breakfast.
group,/ɡruːp/,A number of people or things together.,集まり・グループ,We worked in a group of five.,He joined a music group.,The group went to the museum together.
meeting,/ˈmiː.tɪŋ/,A time when people come together to talk.,会議,We have a meeting at three.,The meeting was very long.,She is in a meeting right now.
report,/rɪˈpɔːt/,A written or spoken account of something.,報告書・レポート,I wrote a report about my trip.,The teacher read my report.,Please finish the report by Friday.
plan,/plæn/,An idea about what you will do.,計画・予定,What is your plan for the weekend?,We made a plan for the trip.,Do you have any plans tomorrow?
work,/wɜːk/,To do a job or activity.,働く・仕事をする,My father works at a hospital.,She works very hard.,I want to work in Japan.
pay,/peɪ/,To give money for something.,支払う,I will pay for the lunch.,How much did you pay?,Please pay at the counter.
clear,/klɪər/,Easy to understand or see through.,明確な・明らかな,The instructions are very clear.,The water in the lake is clear.,It was a clear sunny day.
different,/ˈdɪf.ər.ənt/,Not the same as another.,違う・異なる,My bag is different from yours.,We have different ideas.,Every country has a different culture.
believe,/bɪˈliːv/,To think that something is true.,思う・信じる,I believe he is honest.,Do you believe this story?,She believes in herself.
subject,/ˈsʌb.dʒekt/,An area of study at school.,話題・教科,What is your favorite subject?,We study many subjects at school.,Math is a difficult subject.
public,/ˈpʌb.lɪk/,Open to or shared by all people.,公共の・公立の,This is a public library.,He went to a public school.,The park is a public space.
war,/wɔːr/,A fight between countries or large groups.,戦争,War is a terrible thing.,Many people lost their homes in the war.,We should work for peace not war.
action,/ˈæk.ʃən/,Something that you do.,行為・行動,We need to take action now.,His quick action saved the child.,Actions speak louder than words.
receive,/rɪˈsiːv/,To get something that is sent or given to you.,受け取る・得る,I received a letter from my friend.,She received a nice present.,Did you receive my email?
reach,/riːtʃ/,To arrive at a place or to stretch out your hand.,到着する・届く,We reached the top of the mountain.,Can you reach that book on the shelf?,The train reached Tokyo at noon.
probably,/ˈprɒb.ə.bli/,Almost certainly or most likely.,多分・恐らく,It will probably rain tomorrow.,She is probably at home now.,He will probably come to the party.
history,/ˈhɪs.tər.i/,The study of past events.,歴史,I like studying Japanese history.,She knows a lot about world history.,History is an interesting subject.
grow,/ɡrəʊ/,To get bigger or to raise plants.,成長する・育てる,Children grow fast.,My grandmother grows tomatoes.,The tree grew very tall.
kill,/kɪl/,To cause something to die.,殺す,The cat killed the mouse.,Cold weather can kill plants.,The hero killed the monster in the story.
enjoy,/ɪnˈdʒɔɪ/,To get pleasure from something.,楽しむ,I enjoy reading books.,Did you enjoy the movie?,She enjoys playing the piano.
finally,/ˈfaɪ.nə.li/,After a long time or at the end.,ついに・最終的に,We finally arrived at the hotel.,I finally finished my homework.,She finally found her lost ring.
final,/ˈfaɪ.nəl/,Last in a series or at the end.,最後の・最終の,This is the final question.,The final day of school is Friday.,She won the final match.
prepare,/prɪˈpeər/,To make something ready.,用意する・準備する,I need to prepare for the test.,She prepared a nice dinner.,Please prepare your notebooks.
goal,/ɡəʊl/,Something you want to achieve.,目標・ゴール,My goal is to speak English well.,He scored a goal in the game.,She set a new goal for herself.
adult,/ˈæd.ʌlt/,A fully grown person.,大人・成人,This movie is for adults only.,He became an adult this year.,Adults should be kind to children.
exercise,/ˈek.sə.saɪz/,Physical activity to keep your body healthy.,運動・練習,I do exercise every morning.,Walking is good exercise.,She does exercise after school.
collect,/kəˈlekt/,To bring things together in one place.,集める,I collect stamps from many countries.,He collects old coins.,She collected shells at the beach.
strange,/streɪndʒ/,Unusual or surprising.,変わった・変な,I heard a strange noise.,That was a strange dream.,He told me a strange story.
gentleman,/ˈdʒen.tl.mən/,A polite and well-mannered man.,紳士,He is a real gentleman.,The gentleman opened the door for us.,Ladies and gentlemen!
factory,/ˈfæk.tər.i/,A building where things are made by machines.,工場,My uncle works in a car factory.,The factory makes chocolate.,We visited a toy factory.
guest,/ɡest/,A person who is invited to a place or event.,招待客・宿泊客,We have a guest for dinner tonight.,The hotel has many guests.,Please welcome our special guest.
traffic,/ˈtræf.ɪk/,The cars and vehicles on a road.,交通（量）,The traffic is very heavy today.,Be careful of the traffic.,There was a lot of traffic this morning.
expensive,/ɪkˈspen.sɪv/,Costing a lot of money.,高価な,This bag is too expensive for me.,Tokyo is an expensive city.,The restaurant was very expensive.
worry,/ˈwʌr.i/,To feel anxious or troubled about something.,心配する,Don't worry about the test.,My mother worries about me.,He is worried about his grade.
mistake,/mɪˈsteɪk/,Something that is not correct.,間違い・誤り,I made a mistake on the test.,Don't be afraid of making mistakes.,Everyone makes mistakes sometimes.
paint,/peɪnt/,To make a picture using colors.,（絵の具で）描く・塗る,She painted a beautiful picture.,I like to paint flowers.,He painted the wall blue.
poem,/ˈpəʊ.ɪm/,A piece of writing with rhythm and feeling.,（一編の）詩,She wrote a beautiful poem.,We read a poem in English class.,This poem is about nature.
lovely,/ˈlʌv.li/,Very beautiful or pleasant.,愛らしい・すてきな,What a lovely dress!,She has a lovely smile.,It was a lovely sunny day.
shut,/ʃʌt/,To close something.,閉める・閉じる,Please shut the door.,He shut his eyes and slept.,Shut the window please.
drama,/ˈdrɑː.mə/,A play or a type of story for the stage or TV.,演劇・ドラマ,We performed a drama at school.,She likes watching drama on TV.,The school drama club is fun.
favorite,/ˈfeɪ.vər.ɪt/,Liked more than all others.,お気に入りの・好きな,Blue is my favorite color.,What is your favorite food?,This is my favorite song.
exciting,/ɪkˈsaɪ.tɪŋ/,Making you feel happy and enthusiastic.,わくわくする・興奮させる,The soccer game was very exciting.,We had an exciting trip.,What exciting news!
joy,/dʒɔɪ/,A feeling of great happiness.,喜び・歓喜,Her face was full of joy.,The baby brought us great joy.,I felt joy when I passed the test.
borrow,/ˈbɒr.əʊ/,To take something and give it back later.,借りる,Can I borrow your pen?,I borrowed a book from the library.,She borrowed my umbrella.
communicate,/kəˈmjuː.nɪ.keɪt/,To share information with others.,連絡を取り合う・伝える,We communicate by email.,It is important to communicate well.,She can communicate in three languages.
volunteer,/ˌvɒl.ənˈtɪər/,A person who works without pay to help others.,ボランティア,She works as a volunteer.,Many volunteers helped after the earthquake.,I want to be a volunteer.
diary,/ˈdaɪ.ər.i/,A book where you write about your daily life.,日記,I write in my diary every night.,She keeps a diary in English.,I read my old diary yesterday.
ceremony,/ˈser.ɪ.mə.ni/,A formal event for a special occasion.,式典,We had a graduation ceremony.,The opening ceremony was beautiful.,Many people came to the ceremony.
desert,/ˈdez.ət/,A large dry area of land with very little rain.,砂漠,The Sahara is the largest desert.,It is very hot in the desert.,Few animals live in the desert.
brush,/brʌʃ/,To clean or make smooth using a brush.,ブラシをかける・磨く,I brush my teeth every morning.,She brushed her long hair.,Please brush your teeth before bed.
graduate,/ˈɡrædʒ.u.eɪt/,To finish school and receive a certificate.,卒業する,She will graduate next March.,He graduated from high school.,I want to graduate with good grades.
liberty,/ˈlɪb.ə.ti/,The freedom to live as you choose.,解放・自由,The Statue of Liberty is in New York.,Everyone should have liberty.,They fought for liberty.
uniform,/ˈjuː.nɪ.fɔːm/,Special clothes worn by members of a group.,制服,We wear a uniform to school.,Her uniform is navy blue.,He put on his school uniform.
state,/steɪt/,A part of a country or a condition.,州・国家,California is a big state.,The state of the road was bad.,There are fifty states in America.
practice,/ˈpræk.tɪs/,To do something many times to get better.,練習,I practice the piano every day.,Practice makes perfect.,He practices soccer after school.
kind,/kaɪnd/,Friendly and caring about others.,親切な・優しい,She is a very kind person.,Be kind to animals.,He gave me a kind smile.
statue,/ˈstæt.juː/,A figure of a person or animal made from stone or metal.,像,There is a big statue in the park.,We saw a famous statue.,The statue was very old.
whale,/weɪl/,A very large animal that lives in the sea.,クジラ,We saw a whale in the ocean.,Whales are the largest animals.,The whale jumped out of the water.
stadium,/ˈsteɪ.di.əm/,A large open area for sports events.,競技場・野球場,The stadium was full of people.,We watched a game at the stadium.,The new stadium is very big.
exit,/ˈek.sɪt/,A way out of a building or place.,出口,Where is the exit?,The exit is on the left.,Please use the emergency exit.
