word,phonetic,definition_en,definition_ja,sentence_1,sentence_2,sentence_3
theater,/ˈθɪə.tər/,A place where you watch plays or movies.,劇場・映画館,We went to the theater last night.,The theater was very crowded.,There is a new movie at the theater.
get angry,/ɡet ˈæŋ.ɡri/,To become upset or mad.,怒る,My father got angry yesterday.,Please don't get angry with me.,She gets angry when I am late.
turn left,/tɜːn left/,To go to the left side.,左に曲がる,Turn left at the next corner.,You must turn left here.,The car turned left slowly.
turn right,/tɜːn raɪt/,To go to the right side.,右に曲がる,Turn right at the traffic light.,Can we turn right here?,Please turn right and walk straight.
go to bed,/ɡəʊ tuː bed/,To get into bed to sleep.,ベッドに入る・寝る,I usually go to bed at ten.,You should go to bed early tonight.,What time do you go to bed?
tell a lie,/tel ə laɪ/,To say something that is not true.,嘘をつく,Don't tell a lie to your parents.,He never tells a lie.,It is bad to tell a lie.
have fun,/hæv fʌn/,To enjoy yourself.,楽しむ・楽しい時間を過ごす,Let's have fun at the party!,We had fun at the beach yesterday.,I hope you have fun today.
take care of,/teɪk keər ɒv/,To look after someone or something.,～の世話をする,Please take care of my dog today.,She takes good care of her brother.,Who will take care of these plants?
win a prize,/wɪn ə praɪz/,To get an award in a competition.,受賞する・入賞する,She won a prize in the contest.,He hopes to win a prize.,Our team won a gold prize.
have,/hæv/,To own or possess something.,持っている,I have two brothers.,She has a cute dog.,Do you have a pencil?
say,/seɪ/,To speak words out loud.,言う,What did you say?,She said hello to me.,Please say it again.
go,/ɡəʊ/,To move from one place to another.,行く,Let's go to the park.,I go to school by bus.,Where are you going?
all,/ɔːl/,Every one or the whole of something.,全部の・すべての,All the students are here.,I ate all of the cake.,She knows all the answers.
get,/ɡet/,To receive or obtain something.,得る・手に入れる,I got a new book yesterday.,She got a good score on the test.,Where can I get a ticket?
see,/siː/,To use your eyes to look at something.,見える・見る,I can see the mountain from here.,Did you see the rainbow?,I want to see that movie.
well,/wel/,In a good or proper way.,良く・上手に,She speaks English very well.,He did well on the test.,I slept well last night.
make,/meɪk/,To create or produce something.,作る,Let's make a cake together.,She made a card for her mother.,I made a new friend today.
think,/θɪŋk/,To use your mind to form ideas.,思う・考える,I think this is a good idea.,What do you think about it?,She thinks carefully before speaking.
come,/kʌm/,To move toward the speaker or a place.,来る,Come here please.,She came to school early today.,Can you come to my party?
people,/ˈpiː.pəl/,Men and women in general.,人々,Many people live in this city.,Japanese people are very polite.,People were waiting for the bus.
other,/ˈʌð.ər/,Different from the one mentioned.,他の・もう一方の,I want the other one.,She talks to other students.,What other sports do you like?
give,/ɡɪv/,To let someone have something.,与える,I gave my friend a present.,She gives food to her cat.,Please give me some water.
want,/wɒnt/,To wish for or desire something.,欲しい・～したい,I want a glass of juice.,She wants to go to America.,What do you want for your birthday?
way,/weɪ/,A road or path to a place.,方向・道,Can you show me the way?,This is the way to the station.,We walked all the way home.
day,/deɪ/,A period of 24 hours.,日・日中,Today is a beautiful day.,What day is it today?,I study English every day.
thing,/θɪŋ/,An object or item.,物・事,What is that thing on the table?,I have many things to do.,The most important thing is to try.
tell,/tel/,To give information to someone by speaking.,伝える・言う・教える,Please tell me your name.,She told me a funny story.,Can you tell me the time?
find,/faɪnd/,To discover something you were looking for.,見つける,I found my lost key.,Can you find my bag?,She found a nice restaurant.
mean,/miːn/,To have a particular meaning.,意味する,What does this word mean?,I didn't mean to hurt you.,This sign means stop.
there,/ðeər/,In or at that place.,そこに・そこで,I went there yesterday.,Put the book over there.,Is anyone there?
man,/mæn/,An adult male person.,男・男性,The man is wearing a hat.,A tall man helped me.,That man is my teacher.
many,/ˈmen.i/,A large number of.,たくさんの・多数の,There are many books in the library.,How many students are in your class?,I have many friends at school.
same,/seɪm/,Not different or exactly alike.,同じ,We go to the same school.,She has the same bag as me.,We have the same birthday.
leave,/liːv/,To go away from a place.,出発する・去る,I leave home at seven.,The train leaves at nine.,She left the room quietly.
another,/əˈnʌð.ər/,One more or a different one.,もう一つの・別の,Can I have another piece of cake?,Let's try another way.,She moved to another city.
course,/kɔːs/,A set of lessons or a direction.,講座・教科,I took an English course.,Of course I will help you.,She finished the cooking course.
child,/tʃaɪld/,A young person.,子ども,The child is playing in the park.,Every child needs love.,She was a happy child.
never,/ˈnev.ər/,Not at any time.,決して～ない,I have never been to Canada.,She never eats meat.,He is never late for school.
feel,/fiːl/,To have an emotion or sensation.,感じる,I feel happy today.,She feels tired after running.,How do you feel now?
call,/kɔːl/,To telephone someone or say their name loudly.,電話する・呼ぶ,I will call you tonight.,She called my name.,Can you call a taxi for me?
own,/əʊn/,Belonging to yourself.,自分自身の,I have my own room.,She made her own lunch.,He rides his own bicycle.
great,/ɡreɪt/,Very good or wonderful.,すばらしい・とても良い,That is a great idea!,We had a great time.,She is a great teacher.
part,/pɑːt/,A piece of something larger.,一部・部分,This is the best part of the book.,He played a part in the school play.,I finished the first part.
woman,/ˈwʊm.ən/,An adult female person.,女の人・女性,The woman smiled at me.,A young woman helped us.,That woman is a doctor.
place,/pleɪs/,A particular area or position.,場所,This is a beautiful place.,What is your favorite place?,Let's find a quiet place to study.
life,/laɪf/,The time between birth and death.,生活・人生,She has a happy life.,This is the best day of my life.,Life in Tokyo is very busy.
end,/end/,The final part of something.,端・終わり,The movie has a happy end.,Walk to the end of the street.,This is the end of the lesson.
like,/laɪk/,To enjoy or be fond of something.,好き,I like music very much.,She likes cats.,Do you like swimming?
write,/raɪt/,To put words on paper or a screen.,書く,Please write your name here.,She wrote a letter to her friend.,I write in my diary every day.
move,/muːv/,To change position or go to a new place.,動かす・引っ越す,Don't move!,We moved to a new house.,He moved the desk to the corner.
world,/wɜːld/,The earth and all the people on it.,世界・地球,I want to travel around the world.,There are many languages in the world.,She is the best singer in the world.
right,/raɪt/,Correct or true.,正しい・合っている,Your answer is right.,Turn right at the corner.,Is this the right way?
become,/bɪˈkʌm/,To start to be something.,なる,She became a doctor.,He wants to become a pilot.,It became dark outside.
read,/riːd/,To look at and understand written words.,読む・読書する,I like to read books.,She reads every night.,Have you read this story?
large,/lɑːdʒ/,Big in size or amount.,大きな・多い,They live in a large house.,The school has a large library.,We need a large table.
late,/leɪt/,After the expected time.,（時間的に）遅い・遅れた,I was late for school today.,It is getting late.,Don't stay up too late.
begin,/bɪˈɡɪn/,To start doing something.,始める・始まる,The class begins at nine.,Let's begin the lesson.,It began to rain.
face,/feɪs/,The front part of your head.,顔,She has a kind face.,Wash your face every morning.,He made a funny face.
real,/rɪəl/,Actually existing or true.,本物の・実際の,Is this a real diamond?,Tell me the real reason.,It was a real surprise.
look,/lʊk/,To seem or appear.,～に見える,You look happy today.,She looks tired.,That looks delicious.
next,/nekst/,Coming immediately after.,次の・最も近い,See you next week.,The next train is at ten.,Who is the next speaker?
start,/stɑːt/,To begin doing something.,始める・始まる,School starts at eight.,Let's start cooking.,It started to snow.
show,/ʃəʊ/,To let someone see something.,見せる・示す,Show me your notebook.,She showed us her photos.,Can you show me the way?
bring,/brɪŋ/,To carry something to a place.,持ってくる・連れてくる,Please bring your textbook.,She brought her friend to the party.,Bring an umbrella tomorrow.
money,/ˈmʌn.i/,Coins and notes used to buy things.,お金,I don't have enough money.,She saved a lot of money.,How much money do you need?
night,/naɪt/,The time when it is dark outside.,夜,I study at night.,Good night!,The stars are bright at night.
question,/ˈkwes.tʃən/,Something you ask to get information.,質問・問題,Do you have any questions?,That is a good question.,I answered all the questions.
hear,/hɪər/,To receive sound through your ears.,聞く・聞こえる,I can hear the birds singing.,Did you hear the news?,Can you hear me?
country,/ˈkʌn.tri/,A nation with its own government.,国,Japan is a beautiful country.,Which country do you want to visit?,She has been to many countries.
happen,/ˈhæp.ən/,To take place or occur.,起こる・生じる,What happened yesterday?,Accidents can happen anytime.,Something strange happened today.
talk,/tɔːk/,To speak with someone.,話す,Let's talk about the trip.,She talked to the teacher.,I want to talk to you.
idea,/aɪˈdɪə/,A thought or plan in your mind.,考え・意見,That is a wonderful idea!,Do you have any ideas?,She had a good idea.
hold,/həʊld/,To carry something in your hands.,手に持つ・抱く,Please hold this bag for me.,She held the baby carefully.,Hold my hand.
family,/ˈfæm.ə.li/,Parents and their children.,家族・家庭,I love my family very much.,Her family is very large.,We had dinner with my family.
hour,/aʊər/,A period of sixty minutes.,1時間,The movie is two hours long.,I studied for one hour.,We arrived an hour early.
sit,/sɪt/,To rest your body on a chair or the floor.,座る,Please sit down.,She sat on the bench.,I sat next to my friend.
set,/set/,To put something in a place or position.,準備する・置く,I set the alarm for six.,She set the plates on the table.,Let's set a time to meet.
young,/jʌŋ/,Not old or in the early part of life.,若い・幼い,She is a young teacher.,He looks very young.,Young people like this music.
head,/hed/,The top part of your body.,頭,I have a pain in my head.,She shook her head.,He hit his head on the door.
change,/tʃeɪndʒ/,To make or become different.,変える・交換する,Can you change seats with me?,The weather changed suddenly.,I want to change my hairstyle.
meet,/miːt/,To see and talk to someone for the first time.,出会う・会う,Nice to meet you.,I met her at the library.,Let's meet at the station.
stand,/stænd/,To be on your feet.,立つ,Please stand up.,He stood near the door.,She was standing in the rain.
person,/ˈpɜː.sən/,A human being.,人,She is a very nice person.,Each person has one ticket.,He is the right person for the job.
a lot,/ə lɒt/,A large amount or very much.,たくさん,Thank you a lot!,I learned a lot today.,She reads a lot.
sure,/ʃɔːr/,Certain or confident about something.,確信している・きっと,Are you sure about that?,I am sure she will come.,Sure! I can help you.
later,/ˈleɪ.tər/,At a time in the future.,あとで,See you later!,I will call you later.,Let's talk about it later.
power,/ˈpaʊ.ər/,The ability to do something or control others.,力・権力,Knowledge is power.,The storm cut the power.,He has the power to change things.
understand,/ˌʌn.dəˈstænd/,To know the meaning of something.,理解する,I understand the question.,Do you understand English?,She understood the lesson well.
decide,/dɪˈsaɪd/,To make a choice about something.,決心する・決める,I decided to study harder.,She decided to join the club.,Have you decided yet?
wait,/weɪt/,To stay in one place until something happens.,待つ,Please wait a moment.,I waited for the bus.,She is waiting for her friend.
build,/bɪld/,To make something by putting parts together.,建てる・築く,They are building a new school.,He built a birdhouse.,She wants to build a robot.
light,/laɪt/,Something that makes things visible.,光・明かり,Turn on the light please.,The light from the sun is warm.,There is a light in the window.
special,/ˈspeʃ.əl/,Better or different from usual.,特別な,Today is a special day.,She prepared a special dinner.,You are a very special person.
hard,/hɑːd/,Difficult to do or understand.,難しい・大変な,This question is very hard.,She studies hard every day.,It is hard to get up early.
early,/ˈɜː.li/,Before the usual or expected time.,早く,I woke up early this morning.,She came to school early.,Let's start early tomorrow.
passport,/ˈpɑːs.pɔːt/,An official book for travel to other countries.,パスポート,Don't forget your passport.,I got a new passport.,Show your passport at the airport.
ticket,/ˈtɪk.ɪt/,A small paper that shows you have paid.,航空券・切符,I bought a train ticket.,Where can I buy a ticket?,She lost her movie ticket.
airport,/ˈeə.pɔːt/,A place where airplanes take off and land.,空港,We arrived at the airport early.,The airport is very big.,My father works at the airport.
miss,/mɪs/,To fail to catch or be too late for.,乗り遅れる・逃す,I missed the last train.,Don't miss this chance.,She missed the bus this morning.
lose,/luːz/,To no longer have something.,なくす,I lost my wallet.,Don't lose your key.,She lost her way in the city.
subway,/ˈsʌb.weɪ/,A train that runs underground.,地下鉄,Let's take the subway.,The subway is very fast.,I ride the subway to school.
bus stop,/bʌs stɒp/,A place where buses stop for passengers.,バス乗り場・バスの停留所,Wait for me at the bus stop.,The bus stop is across the street.,She is standing at the bus stop.
on foot,/ɒn fʊt/,By walking.,徒歩で,I go to school on foot.,The park is ten minutes on foot.,She came here on foot.
get on,/ɡet ɒn/,To go onto a bus or train.,～に乗る,Let's get on the bus.,She got on the train at Shibuya.,Please get on the next bus.
bicycle,/ˈbaɪ.sɪ.kəl/,A vehicle with two wheels that you ride.,自転車,I ride a bicycle to school.,He bought a new bicycle.,She can fix a bicycle.
member,/ˈmem.bər/,A person who belongs to a group.,メンバー・会員,I am a member of the tennis club.,She is a new member.,All members came to the meeting.
month,/mʌnθ/,One of the twelve parts of a year.,月・ひと月,January is the first month.,I have been here for three months.,What month is it now?
already,/ɔːlˈred.i/,Before now or before a particular time.,既に・もう,I have already finished my homework.,She has already left.,Have you already eaten lunch?
example,/ɪɡˈzɑːm.pəl/,Something that shows what others are like.,例,For example I like tennis.,Can you give me an example?,This is a good example.
line,/laɪn/,A long thin mark on a surface.,線,Draw a straight line.,There is a long line at the store.,Stand in line please.
minute,/ˈmɪn.ɪt/,A period of sixty seconds.,分,Wait a minute please.,The station is five minutes away.,I finished in ten minutes.
left,/left/,On the side of your body where your heart is.,左の・左側の,Turn left at the corner.,My left hand hurts.,The library is on the left.
full,/fʊl/,Having no empty space.,いっぱいの,The bus was full of people.,I am full after lunch.,The glass is full of water.
paper,/ˈpeɪ.pər/,Thin material used for writing.,紙・書類,I need a piece of paper.,She wrote on the paper.,Please hand in your paper.
far,/fɑːr/,A long distance away.,遠い,How far is the station?,My school is not far from here.,She lives far from the city.
morning,/ˈmɔː.nɪŋ/,The first part of the day.,朝,Good morning everyone!,I study in the morning.,She jogs every morning.
only,/ˈəʊn.li/,Nothing more or no one else.,唯一の・ただ～だけの,I have only one sister.,She is the only girl in the team.,I ate only a little rice.
city,/ˈsɪt.i/,A large town.,都市・都会,Tokyo is a big city.,I want to live in a city.,The city is very busy.
hope,/həʊp/,To want something to happen.,望む・期待する,I hope you feel better soon.,She hopes to visit Japan.,We hope to win the game.
spend,/spend/,To use time or money.,（お金・時間を）使う・費やす,I spent two hours studying.,She spends money carefully.,We spent the day at the beach.
once,/wʌns/,One time only.,一度,I have been there once.,Once upon a time there was a king.,She visits her grandmother once a month.
difficult,/ˈdɪf.ɪ.kəlt/,Not easy to do or understand.,難しい・困難な,This question is very difficult.,Japanese is a difficult language.,The test was not difficult.
win,/wɪn/,To come first in a game or contest.,勝つ,Our team won the game.,She wants to win the race.,Who won the match?
sometimes,/ˈsʌm.taɪmz/,On some occasions but not always.,時々・たまに,I sometimes eat curry.,She sometimes walks to school.,He sometimes forgets his lunch.
easy,/ˈiː.zi/,Not difficult to do.,簡単な,This game is very easy.,English is not always easy.,That was an easy question.
break,/breɪk/,To separate into pieces by force.,壊す・骨折する,Don't break the window.,He broke his leg last week.,She broke a glass yesterday.
wrong,/rɒŋ/,Not correct or not right.,間違った・悪い,Your answer is wrong.,What is wrong with you?,I took the wrong train.
eat,/iːt/,To put food in your mouth and swallow it.,食べる,I eat breakfast every day.,What did you eat for lunch?,She eats a lot of vegetables.
sorry,/ˈsɒr.i/,Feeling sad about something you did.,すまないと思う・ごめんなさい,I am sorry I am late.,Sorry I broke your cup.,She said sorry to him.
teach,/tiːtʃ/,To help someone learn something.,教える,My mother teaches English.,She taught me how to cook.,Who teaches your math class?
hot,/hɒt/,Having a high temperature.,暑い・熱い,It is very hot today.,The tea is too hot to drink.,Summer in Tokyo is very hot.
dad,/dæd/,A word for father used in conversation.,（会話で）お父さん,My dad is a teacher.,I helped my dad in the garden.,Dad cooks dinner on weekends.
study,/ˈstʌd.i/,To learn about a subject.,勉強する,I study English every day.,She studies hard for tests.,Where do you usually study?
town,/taʊn/,A place with houses and shops smaller than a city.,町・町なか,I live in a small town.,The town has a beautiful park.,We walked around the town.
certainly,/ˈsɜː.tən.li/,Without any doubt.,確かに・必ず,She is certainly very smart.,Certainly I will help you.,He will certainly pass the test.
open,/ˈəʊ.pən/,Not closed or to make something not closed.,開いている・開ける,The door is open.,Please open your textbook.,The store is open until nine.
church,/tʃɜːtʃ/,A building where people go to pray.,教会,There is an old church in our town.,We visited a beautiful church.,The church has a tall tower.
die,/daɪ/,To stop living.,死ぬ,The flowers died without water.,His grandfather died last year.,Many fish die in polluted water.
draw,/drɔː/,To make a picture with a pen or pencil.,（ペンなどで）描く,I like to draw animals.,She drew a picture of her cat.,Can you draw a map for me?
short,/ʃɔːt/,Not long or not tall.,背が低い・短い,She has short hair.,The movie was very short.,He is shorter than his brother.
south,/saʊθ/,The direction opposite to north.,南・南部,Okinawa is in the south of Japan.,Birds fly south in winter.,The wind comes from the south.
difference,/ˈdɪf.ər.əns/,The way things are not the same.,違い,Can you see the difference?,There is a big difference between them.,What is the difference?
north,/nɔːθ/,The direction that is up on a map.,北・北部,Hokkaido is in the north.,The wind blows from the north.,We traveled to the north.
learn,/lɜːn/,To get knowledge or skill.,学ぶ・習う,I want to learn French.,She learned to swim last summer.,We learn many things at school.
teacher,/ˈtiː.tʃər/,A person who teaches at a school.,先生・教師,My teacher is very kind.,I want to be a teacher.,The teacher helped me with math.
parent,/ˈpeər.ənt/,A father or a mother.,親,My parents are very kind.,She lives with her parents.,I love my parents very much.
pass,/pɑːs/,To go past something or to succeed.,通る・合格する,We passed the park on the way.,She passed the exam.,Please pass me the salt.
soon,/suːn/,In a short time from now.,まもなく・もうすぐ,The bus will come soon.,See you soon!,Spring will come soon.
free,/friː/,Not costing any money or not busy.,無料の・自由な,This app is free.,Are you free tomorrow?,The concert tickets are free.
story,/ˈstɔː.ri/,A description of events that may be real or not.,話・物語,She told me a funny story.,I read a story before bed.,This is a famous story.
wife,/waɪf/,A married woman.,妻・奥さん,His wife is a teacher.,My wife likes cooking.,He gave flowers to his wife.
piece,/piːs/,A part of something larger.,一片・一切れ,Can I have a piece of cake?,She cut the paper into pieces.,I need a piece of advice.
west,/west/,The direction where the sun goes down.,西・西部,The sun sets in the west.,She traveled to the west.,The wind blows from the west.
hospital,/ˈhɒs.pɪ.təl/,A place where sick people go for treatment.,病院,She went to the hospital.,The hospital is near the station.,My grandmother is in the hospital.
language,/ˈlæŋ.ɡwɪdʒ/,A system of words people use to communicate.,言語・語学,How many languages do you speak?,English is a useful language.,She is studying a new language.
picture,/ˈpɪk.tʃər/,A drawing or photograph.,絵・写真,She took a picture of the flowers.,I drew a picture of my dog.,Look at this picture.
doctor,/ˈdɒk.tər/,A person who helps sick people get better.,医師,I went to see a doctor.,She wants to be a doctor.,The doctor gave me some medicine.
fire,/faɪər/,The heat and light from something burning.,火・火事,Be careful with fire.,There was a fire in the building.,We sat around the fire.
wear,/weər/,To have clothes on your body.,身につける・着ている,I wear a uniform to school.,She is wearing a red hat.,He wears glasses.
top,/tɒp/,The highest point or part.,頂上・最高部,We climbed to the top of the hill.,Put it on top of the desk.,He finished at the top of his class.
join,/dʒɔɪn/,To become a member of a group.,加わる・参加する,I want to join the soccer club.,She joined the drama club.,Will you join us for lunch?
field,/fiːld/,A large open area of land.,野原・競技場,The children are playing in the field.,We practiced on the soccer field.,The field is full of flowers.
university,/ˌjuː.nɪˈvɜː.sə.ti/,A place where people study after high school.,（総合）大学,She goes to a university in Tokyo.,My brother is at university.,I want to go to university.
poor,/pɔːr/,Having very little money.,貧しい,The poor boy had no shoes.,She helps poor children.,We should help poor people.
evening,/ˈiːv.nɪŋ/,The part of the day between afternoon and night.,夕方・晩,Good evening!,I read books in the evening.,We had dinner in the evening.
especially,/ɪˈspeʃ.əl.i/,More than usual or more than others.,特に,I like fruit especially apples.,She is especially good at math.,The park is beautiful especially in spring.
hair,/heər/,The thin threads growing on your head.,髪の毛・毛,She has long black hair.,I cut my hair yesterday.,He brushes his hair every morning.
size,/saɪz/,How big or small something is.,大きさ・サイズ,What size shoes do you wear?,This shirt is the wrong size.,The size of the room is small.
finish,/ˈfɪn.ɪʃ/,To complete something or bring to an end.,終える・終わる,I finished my homework.,The movie will finish at nine.,She finished reading the book.
lady,/ˈleɪ.di/,A polite word for a woman.,婦人・女性,The lady smiled at me.,Ladies and gentlemen!,An old lady lives next door.
east,/iːst/,The direction where the sun comes up.,東・東部,The sun rises in the east.,Tokyo is in the east of Japan.,We traveled east.
central,/ˈsen.trəl/,In the center or middle of something.,中心的な・主要な,The hotel is in a central location.,Central Park is in New York.,This is a central problem.
catch,/kætʃ/,To grab something that is moving.,捕まえる・とる,Catch the ball!,He caught a big fish.,She ran to catch the bus.
save,/seɪv/,To keep someone or something from danger.,救う・貯める,He saved the cat from the tree.,She saves money every month.,I want to save the environment.
son,/sʌn/,A male child.,息子,He has two sons.,My son is ten years old.,Her son goes to this school.
restaurant,/ˈres.tər.ɒnt/,A place where you pay to eat meals.,レストラン,Let's go to a restaurant.,This restaurant has good pizza.,The restaurant is always busy.
